[
  {
    "schema_version": "1.0",
    "job_id": "job_adz_001",
    "job_title": "Senior Python Backend Engineer",
    "company": "CloudScale Systems",
    "location": "Berlin, Germany",
    "source": "adzuna",
    "description": "We are seeking a Senior Python Backend Engineer to build scalable microservices using FastAPI, PostgreSQL, and Redis.",
    "application_url": "https://careers.cloudscale.example/jobs/001",
    "required_skills": [
      "Python",
      "FastAPI",
      "PostgreSQL",
      "Docker"
    ],
    "preferred_skills": [
      "Redis",
      "n8n"
    ],
    "technologies": [
      "Python",
      "FastAPI",
      "PostgreSQL"
    ],
    "employment_type": "Full-time",
    "seniority_level": "Senior",
    "salary": "€75,000 - €90,000",
    "education_requirement": "B.Sc. in Computer Science",
    "required_experience_years": 4,
    "retrieved_at": "2026-08-17T12:05:00Z"
  },
  {
    "schema_version": "1.0",
    "job_id": "job_jooble_003",
    "job_title": "Junior Java Developer",
    "company": "Fintech Legacy Corp",
    "location": "Frankfurt, Germany",
    "source": "jooble",
    "description": "Junior Java Developer working on legacy banking systems.",
    "application_url": "https://fintechlegacy.example/apply/java-jr",
    "required_skills": [
      "Java",
      "Spring Boot",
      "Oracle DB"
    ],
    "preferred_skills": [],
    "technologies": [
      "Java",
      "Oracle"
    ],
    "employment_type": "Full-time",
    "seniority_level": "Junior",
    "salary": "€45,000",
    "education_requirement": "B.Sc. in Computer Science",
    "required_experience_years": 1,
    "retrieved_at": "2026-08-17T12:06:00Z"
  }
]
